[
  {
    "lv": "pieteikties",
    "eng": "to apply (for), to sign up; (IT) to log in",
    "ru": "подать заявку, записаться; (IT) войти в систему",
    "conj": {
      "present": {
        "1s": "",
        "2s": "",
        "3s": "",
        "1p": "",
        "2p": "",
        "3p": ""
      },
      "past": {
        "1s": "",
        "2s": "",
        "3s": "",
        "1p": "",
        "2p": "",
        "3p": ""
      },
      "future": {
        "1s": "",
        "2s": "",
        "3s": "",
        "1p": "",
        "2p": "",
        "3p": ""
      }
    }
  },
  {
    "lv": "piezvanīt",
    "eng": "to call (by phone)",
    "ru": "позвонить",
    "conj": {
      "present": {
        "1s": "",
        "2s": "",
        "3s": "",
        "1p": "",
        "2p": "",
        "3p": ""
      },
      "past": {
        "1s": "",
        "2s": "",
        "3s": "",
        "1p": "",
        "2p": "",
        "3p": ""
      },
      "future": {
        "1s": "",
        "2s": "",
        "3s": "",
        "1p": "",
        "2p": "",
        "3p": ""
      }
    }
  },
  {
    "lv": "pildīt",
    "eng": "to fulfill, to carry out; to fill",
    "ru": "выполнять; наполнять",
    "conj": {
      "present": {
        "1s": "",
        "2s": "",
        "3s": "",
        "1p": "",
        "2p": "",
        "3p": ""
      },
      "past": {
        "1s": "",
        "2s": "",
        "3s": "",
        "1p": "",
        "2p": "",
        "3p": ""
      },
      "future": {
        "1s": "",
        "2s": "",
        "3s": "",
        "1p": "",
        "2p": "",
        "3p": ""
      }
    }
  },
  {
    "lv": "pirkt",
    "eng": "to buy",
    "ru": "покупать",
    "conj": {
      "present": {
        "1s": "",
        "2s": "",
        "3s": "",
        "1p": "",
        "2p": "",
        "3p": ""
      },
      "past": {
        "1s": "",
        "2s": "",
        "3s": "",
        "1p": "",
        "2p": "",
        "3p": ""
      },
      "future": {
        "1s": "",
        "2s": "",
        "3s": "",
        "1p": "",
        "2p": "",
        "3p": ""
      }
    }
  },
  {
    "lv": "plānot",
    "eng": "to plan",
    "ru": "планировать",
    "conj": {
      "present": {
        "1s": "",
        "2s": "",
        "3s": "",
        "1p": "",
        "2p": "",
        "3p": ""
      },
      "past": {
        "1s": "",
        "2s": "",
        "3s": "",
        "1p": "",
        "2p": "",
        "3p": ""
      },
      "future": {
        "1s": "",
        "2s": "",
        "3s": "",
        "1p": "",
        "2p": "",
        "3p": ""
      }
    }
  },
  {
    "lv": "prast",
    "eng": "to know how (to), to be able",
    "ru": "уметь",
    "conj": {
      "present": {
        "1s": "",
        "2s": "",
        "3s": "",
        "1p": "",
        "2p": "",
        "3p": ""
      },
      "past": {
        "1s": "",
        "2s": "",
        "3s": "",
        "1p": "",
        "2p": "",
        "3p": ""
      },
      "future": {
        "1s": "",
        "2s": "",
        "3s": "",
        "1p": "",
        "2p": "",
        "3p": ""
      }
    }
  },
  {
    "lv": "priecāties",
    "eng": "to rejoice, to be glad",
    "ru": "радоваться",
    "conj": {
      "present": {
        "1s": "",
        "2s": "",
        "3s": "",
        "1p": "",
        "2p": "",
        "3p": ""
      },
      "past": {
        "1s": "",
        "2s": "",
        "3s": "",
        "1p": "",
        "2p": "",
        "3p": ""
      },
      "future": {
        "1s": "",
        "2s": "",
        "3s": "",
        "1p": "",
        "2p": "",
        "3p": ""
      }
    }
  },
  {
    "lv": "rādīt",
    "eng": "to show",
    "ru": "показывать",
    "conj": {
      "present": {
        "1s": "",
        "2s": "",
        "3s": "",
        "1p": "",
        "2p": "",
        "3p": ""
      },
      "past": {
        "1s": "",
        "2s": "",
        "3s": "",
        "1p": "",
        "2p": "",
        "3p": ""
      },
      "future": {
        "1s": "",
        "2s": "",
        "3s": "",
        "1p": "",
        "2p": "",
        "3p": ""
      }
    }
  },
  {
    "lv": "rakstīt",
    "eng": "to write",
    "ru": "писать",
    "conj": {
      "present": {
        "1s": "",
        "2s": "",
        "3s": "",
        "1p": "",
        "2p": "",
        "3p": ""
      },
      "past": {
        "1s": "",
        "2s": "",
        "3s": "",
        "1p": "",
        "2p": "",
        "3p": ""
      },
      "future": {
        "1s": "",
        "2s": "",
        "3s": "",
        "1p": "",
        "2p": "",
        "3p": ""
      }
    }
  },
  {
    "lv": "redzēt",
    "eng": "to see",
    "ru": "видеть",
    "conj": {
      "present": {
        "1s": "",
        "2s": "",
        "3s": "",
        "1p": "",
        "2p": "",
        "3p": ""
      },
      "past": {
        "1s": "",
        "2s": "",
        "3s": "",
        "1p": "",
        "2p": "",
        "3p": ""
      },
      "future": {
        "1s": "",
        "2s": "",
        "3s": "",
        "1p": "",
        "2p": "",
        "3p": ""
      }
    }
  },
  {
    "lv": "reģistrēt",
    "eng": "to register",
    "ru": "регистрировать",
    "conj": {
      "present": {
        "1s": "",
        "2s": "",
        "3s": "",
        "1p": "",
        "2p": "",
        "3p": ""
      },
      "past": {
        "1s": "",
        "2s": "",
        "3s": "",
        "1p": "",
        "2p": "",
        "3p": ""
      },
      "future": {
        "1s": "",
        "2s": "",
        "3s": "",
        "1p": "",
        "2p": "",
        "3p": ""
      }
    }
  },
  {
    "lv": "reģistrēties",
    "eng": "to register (oneself)",
    "ru": "регистрироваться",
    "conj": {
      "present": {
        "1s": "",
        "2s": "",
        "3s": "",
        "1p": "",
        "2p": "",
        "3p": ""
      },
      "past": {
        "1s": "",
        "2s": "",
        "3s": "",
        "1p": "",
        "2p": "",
        "3p": ""
      },
      "future": {
        "1s": "",
        "2s": "",
        "3s": "",
        "1p": "",
        "2p": "",
        "3p": ""
      }
    }
  },
  {
    "lv": "rēķināt",
    "eng": "to calculate, to count",
    "ru": "считать, вычислять",
    "conj": {
      "present": {
        "1s": "",
        "2s": "",
        "3s": "",
        "1p": "",
        "2p": "",
        "3p": ""
      },
      "past": {
        "1s": "",
        "2s": "",
        "3s": "",
        "1p": "",
        "2p": "",
        "3p": ""
      },
      "future": {
        "1s": "",
        "2s": "",
        "3s": "",
        "1p": "",
        "2p": "",
        "3p": ""
      }
    }
  },
  {
    "lv": "remontēt",
    "eng": "to repair, to renovate",
    "ru": "ремонтировать",
    "conj": {
      "present": {
        "1s": "",
        "2s": "",
        "3s": "",
        "1p": "",
        "2p": "",
        "3p": ""
      },
      "past": {
        "1s": "",
        "2s": "",
        "3s": "",
        "1p": "",
        "2p": "",
        "3p": ""
      },
      "future": {
        "1s": "",
        "2s": "",
        "3s": "",
        "1p": "",
        "2p": "",
        "3p": ""
      }
    }
  },
  {
    "lv": "rezervēt",
    "eng": "to reserve, to book",
    "ru": "бронировать, резервировать",
    "conj": {
      "present": {
        "1s": "",
        "2s": "",
        "3s": "",
        "1p": "",
        "2p": "",
        "3p": ""
      },
      "past": {
        "1s": "",
        "2s": "",
        "3s": "",
        "1p": "",
        "2p": "",
        "3p": ""
      },
      "future": {
        "1s": "",
        "2s": "",
        "3s": "",
        "1p": "",
        "2p": "",
        "3p": ""
      }
    }
  },
  {
    "lv": "robežoties",
    "eng": "to border (on/with)",
    "ru": "граничить",
    "conj": {
      "present": {
        "1s": "",
        "2s": "",
        "3s": "",
        "1p": "",
        "2p": "",
        "3p": ""
      },
      "past": {
        "1s": "",
        "2s": "",
        "3s": "",
        "1p": "",
        "2p": "",
        "3p": ""
      },
      "future": {
        "1s": "",
        "2s": "",
        "3s": "",
        "1p": "",
        "2p": "",
        "3p": ""
      }
    }
  },
  {
    "lv": "runāt",
    "eng": "to speak, to talk",
    "ru": "говорить, разговаривать",
    "conj": {
      "present": {
        "1s": "",
        "2s": "",
        "3s": "",
        "1p": "",
        "2p": "",
        "3p": ""
      },
      "past": {
        "1s": "",
        "2s": "",
        "3s": "",
        "1p": "",
        "2p": "",
        "3p": ""
      },
      "future": {
        "1s": "",
        "2s": "",
        "3s": "",
        "1p": "",
        "2p": "",
        "3p": ""
      }
    }
  },
  {
    "lv": "sacīt",
    "eng": "to say",
    "ru": "сказать",
    "conj": {
      "present": {
        "1s": "",
        "2s": "",
        "3s": "",
        "1p": "",
        "2p": "",
        "3p": ""
      },
      "past": {
        "1s": "",
        "2s": "",
        "3s": "",
        "1p": "",
        "2p": "",
        "3p": ""
      },
      "future": {
        "1s": "",
        "2s": "",
        "3s": "",
        "1p": "",
        "2p": "",
        "3p": ""
      }
    }
  },
  {
    "lv": "sagaidīt",
    "eng": "to meet; to expect; to wait for",
    "ru": "встречать; ожидать",
    "conj": {
      "present": {
        "1s": "",
        "2s": "",
        "3s": "",
        "1p": "",
        "2p": "",
        "3p": ""
      },
      "past": {
        "1s": "",
        "2s": "",
        "3s": "",
        "1p": "",
        "2p": "",
        "3p": ""
      },
      "future": {
        "1s": "",
        "2s": "",
        "3s": "",
        "1p": "",
        "2p": "",
        "3p": ""
      }
    }
  },
  {
    "lv": "sagatavot",
    "eng": "to prepare",
    "ru": "подготовить, приготовить",
    "conj": {
      "present": {
        "1s": "",
        "2s": "",
        "3s": "",
        "1p": "",
        "2p": "",
        "3p": ""
      },
      "past": {